{
  "schema_version": 1,
  "launch_id": "01K00000000000000000000008",
  "run_id": "01K00000000000000000000009",
  "run_execution_id": "01K00000000000000000000001",
  "assignment_generation": 1,
  "task_id": "01K00000000000000000000002",
  "runner_id": "01K00000000000000000000003",
  "checkout_id": "01K00000000000000000000004",
  "agent_profile_id": "01K00000000000000000000005",
  "config_snapshot_id": "01K00000000000000000000010",
  "config_snapshot_hash": "sha256:aaaaaaaaaaaaaaaaaaaaaaaaaaaaaaaaaaaaaaaaaaaaaaaaaaaaaaaaaaaaaaaa",
  "execution_config": {
    "provider": "fake",
    "mode": "interactive",
    "model": "synthetic",
    "effort": "high",
    "approval_policy": "never",
    "filesystem_policy": "read_only",
    "context_injection": "session_start_additional_context",
    "initial_turn_transport": "provider_prompt",
    "required_capabilities": [
      "launch.interactive",
      "filesystem.read_only",
      "approval.never",
      "context.session_start",
      "prompt.initial_constant",
      "hooks.session_start",
      "mcp.stdio"
    ]
  },
  "expires_at": "2026-09-12T12:02:00.000Z",
  "resume_session": {
    "provider_session_id": "01K00000000000000000000014",
    "observed_session_id": "synthetic-session-1"
  }
}
